{
  "$schema": "../../schema/sprite-pack.schema.json",
  "id": "desert-decorations",
  "name": "Desert Level Decorations",
  "source": "opengameart",
  "license": "CC0",
  "homepage": "https://opengameart.org/content/desert-level-decorations-pixel-art",
  "downloadUrl": "https://opengameart.org/sites/default/files/desert_decorations_0.png",

  "primarySheet": "desert_decorations_0.png",

  "metadata": {
    "author": "ScratchIO",
    "description": "Desert assets for level decoration - cactus, rocks, trees, grass, bushes, sand elements. Part of Desert Tileset series.",
    "notes": "Single PNG file (not zip). Sprite positions need verification after download."
  },

  "sprites": {
    "cactus-tall": { "x": 0, "y": 0, "w": 16, "h": 32 },
    "cactus-small": { "x": 16, "y": 16, "w": 16, "h": 16 },
    "cactus-round": { "x": 32, "y": 16, "w": 16, "h": 16 },
    "rock-large": { "x": 48, "y": 0, "w": 32, "h": 32 },
    "rock-small": { "x": 80, "y": 16, "w": 16, "h": 16 },
    "bush-1": { "x": 96, "y": 16, "w": 16, "h": 16 },
    "bush-2": { "x": 112, "y": 16, "w": 16, "h": 16 },
    "grass-1": { "x": 0, "y": 32, "w": 16, "h": 16 },
    "grass-2": { "x": 16, "y": 32, "w": 16, "h": 16 },
    "tree-dead": { "x": 32, "y": 32, "w": 32, "h": 32 }
  },

  "tags": {
    "vegetation": ["cactus-tall", "cactus-small", "cactus-round", "bush-1", "bush-2", "grass-1", "grass-2", "tree-dead"],
    "cactus": ["cactus-tall", "cactus-small", "cactus-round"],
    "rocks": ["rock-large", "rock-small"],
    "decoration": ["cactus-tall", "cactus-small", "cactus-round", "rock-large", "rock-small", "bush-1", "bush-2", "grass-1", "grass-2", "tree-dead"]
  }
}
