{
  "$schema": "../../schema/sprite-pack.schema.json",
  "id": "tiny-town",
  "name": "Tiny Town",
  "source": "kenney",
  "license": "CC0",
  "homepage": "https://kenney.nl/assets/tiny-town",
  "downloadUrl": "https://kenney.nl/media/pages/assets/tiny-town/5e46f9e551-1735736916/kenney_tiny-town.zip",

  "tileSize": 16,
  "primarySheet": "Tilemap/tilemap_packed.png",

  "metadata": {
    "author": "Kenney",
    "description": "Micro medieval town tileset (16x16) with terrain, buildings, characters, and decorations",
    "totalAssets": 132,
    "gridSize": { "cols": 12, "rows": 11 }
  },

  "sprites": {
    "grass-1": { "x": 0, "y": 0 },
    "grass-2": { "x": 16, "y": 0 },
    "grass-3": { "x": 32, "y": 0 },
    "grass-flowers-1": { "x": 48, "y": 0 },
    "grass-flowers-2": { "x": 64, "y": 0 },
    "grass-flowers-3": { "x": 80, "y": 0 },
    "tree-green-1": { "x": 96, "y": 0 },
    "tree-green-2": { "x": 112, "y": 0 },
    "tree-green-3": { "x": 128, "y": 0 },
    "tree-autumn-1": { "x": 144, "y": 0 },
    "tree-autumn-2": { "x": 160, "y": 0 },
    "tree-autumn-3": { "x": 176, "y": 0 },

    "dirt-1": { "x": 0, "y": 16 },
    "dirt-2": { "x": 16, "y": 16 },
    "sand-1": { "x": 32, "y": 16 },
    "sand-2": { "x": 48, "y": 16 },
    "tree-pine-1": { "x": 64, "y": 16 },
    "tree-pine-2": { "x": 80, "y": 16 },
    "bush-green-1": { "x": 96, "y": 16 },
    "bush-green-2": { "x": 112, "y": 16 },
    "bush-autumn-1": { "x": 128, "y": 16 },
    "bush-autumn-2": { "x": 144, "y": 16 },
    "cactus-1": { "x": 160, "y": 16 },
    "cactus-2": { "x": 176, "y": 16 },

    "dirt-3": { "x": 0, "y": 32 },
    "dirt-4": { "x": 16, "y": 32 },
    "haybale": { "x": 32, "y": 32 },
    "bush-berry": { "x": 48, "y": 32 },
    "mushroom-red": { "x": 64, "y": 32 },
    "flowers-red": { "x": 80, "y": 32 },
    "tree-stump": { "x": 96, "y": 32 },
    "tree-dead": { "x": 112, "y": 32 },
    "tree-green-round": { "x": 128, "y": 32 },
    "tree-autumn-round": { "x": 144, "y": 32 },
    "cactus-flower": { "x": 160, "y": 32 },
    "rock-1": { "x": 176, "y": 32 },

    "path-dirt-1": { "x": 0, "y": 48 },
    "path-dirt-2": { "x": 16, "y": 48 },
    "path-dirt-3": { "x": 32, "y": 48 },
    "path-dirt-4": { "x": 48, "y": 48 },
    "path-dirt-5": { "x": 64, "y": 48 },
    "path-dirt-6": { "x": 80, "y": 48 },
    "path-dirt-7": { "x": 96, "y": 48 },
    "path-stone": { "x": 112, "y": 48 },
    "fence-left": { "x": 128, "y": 48 },
    "fence-mid": { "x": 144, "y": 48 },
    "fence-right": { "x": 160, "y": 48 },
    "fence-post": { "x": 176, "y": 48 },

    "roof-blue-left": { "x": 0, "y": 64 },
    "roof-blue-mid": { "x": 16, "y": 64 },
    "roof-blue-right": { "x": 32, "y": 64 },
    "roof-blue-peak": { "x": 48, "y": 64 },
    "wall-brick-1": { "x": 64, "y": 64 },
    "wall-brick-2": { "x": 80, "y": 64 },
    "wall-brick-window": { "x": 96, "y": 64 },
    "roof-brick-peak": { "x": 112, "y": 64 },
    "chimney-1": { "x": 128, "y": 64 },
    "chimney-smoke": { "x": 144, "y": 64 },
    "chimney-2": { "x": 160, "y": 64 },
    "chimney-3": { "x": 176, "y": 64 },

    "roof-blue-bottom-left": { "x": 0, "y": 80 },
    "roof-blue-bottom-mid": { "x": 16, "y": 80 },
    "roof-blue-bottom-right": { "x": 32, "y": 80 },
    "roof-red-peak": { "x": 48, "y": 80 },
    "wall-brick-3": { "x": 64, "y": 80 },
    "wall-brick-4": { "x": 80, "y": 80 },
    "door-brick": { "x": 96, "y": 80 },
    "window-brick": { "x": 112, "y": 80 },
    "wall-wood-1": { "x": 128, "y": 80 },
    "wall-wood-plank": { "x": 144, "y": 80 },
    "wall-wood-window": { "x": 160, "y": 80 },
    "wall-wood-2": { "x": 176, "y": 80 },

    "wall-wood-3": { "x": 0, "y": 96 },
    "wall-wood-4": { "x": 16, "y": 96 },
    "door-wood": { "x": 32, "y": 96 },
    "wall-wood-5": { "x": 48, "y": 96 },
    "wall-stone-1": { "x": 64, "y": 96 },
    "wall-stone-light": { "x": 80, "y": 96 },
    "window-stone": { "x": 96, "y": 96 },
    "wall-stone-2": { "x": 112, "y": 96 },
    "barrel": { "x": 128, "y": 96 },
    "awning": { "x": 144, "y": 96 },
    "crate": { "x": 160, "y": 96 },
    "chest": { "x": 176, "y": 96 },

    "building-dark-1": { "x": 0, "y": 112 },
    "building-dark-window": { "x": 16, "y": 112 },
    "building-dark-door": { "x": 32, "y": 112 },
    "building-dark-2": { "x": 48, "y": 112 },
    "building-dark-3": { "x": 64, "y": 112 },
    "building-dark-4": { "x": 80, "y": 112 },
    "well": { "x": 96, "y": 112 },
    "fountain": { "x": 112, "y": 112 },
    "coin-gold": { "x": 128, "y": 112 },
    "gold-bag": { "x": 144, "y": 112 },
    "sign-shop": { "x": 160, "y": 112 },
    "sign-arrow": { "x": 176, "y": 112 },

    "water-1": { "x": 0, "y": 128 },
    "water-2": { "x": 16, "y": 128 },
    "water-3": { "x": 32, "y": 128 },
    "water-4": { "x": 48, "y": 128 },
    "water-5": { "x": 64, "y": 128 },
    "water-6": { "x": 80, "y": 128 },
    "bridge-horizontal": { "x": 96, "y": 128 },
    "bridge-vertical": { "x": 112, "y": 128 },
    "dock-1": { "x": 128, "y": 128 },
    "anvil": { "x": 144, "y": 128 },
    "woodpile": { "x": 160, "y": 128 },
    "barrel-brown": { "x": 176, "y": 128 },

    "castle-wall-left": { "x": 0, "y": 144 },
    "castle-wall-mid": { "x": 16, "y": 144 },
    "castle-battlement": { "x": 32, "y": 144 },
    "castle-tower": { "x": 48, "y": 144 },
    "castle-flag": { "x": 64, "y": 144 },
    "castle-gate": { "x": 80, "y": 144 },
    "stone-wall": { "x": 96, "y": 144 },
    "character-villager-1": { "x": 112, "y": 144 },
    "character-villager-2": { "x": 128, "y": 144 },
    "character-guard": { "x": 144, "y": 144 },
    "character-merchant": { "x": 160, "y": 144 },
    "character-king": { "x": 176, "y": 144 },

    "castle-wall-right": { "x": 0, "y": 160 },
    "castle-wall-bottom": { "x": 16, "y": 160 },
    "castle-window": { "x": 32, "y": 160 },
    "banner": { "x": 48, "y": 160 },
    "lamp-post": { "x": 64, "y": 160 },
    "tombstone": { "x": 80, "y": 160 },
    "stone-path": { "x": 96, "y": 160 },
    "character-knight": { "x": 112, "y": 160 },
    "character-wizard": { "x": 128, "y": 160 },
    "character-thief": { "x": 144, "y": 160 },
    "cart": { "x": 160, "y": 160 },
    "boat": { "x": 176, "y": 160 }
  },

  "tags": {
    "terrain": [
      "grass-1", "grass-2", "grass-3",
      "dirt-1", "dirt-2", "dirt-3", "dirt-4",
      "sand-1", "sand-2"
    ],
    "grass": [
      "grass-1", "grass-2", "grass-3",
      "grass-flowers-1", "grass-flowers-2", "grass-flowers-3"
    ],
    "tree": [
      "tree-green-1", "tree-green-2", "tree-green-3",
      "tree-autumn-1", "tree-autumn-2", "tree-autumn-3",
      "tree-pine-1", "tree-pine-2",
      "tree-green-round", "tree-autumn-round",
      "tree-stump", "tree-dead"
    ],
    "vegetation": [
      "bush-green-1", "bush-green-2", "bush-autumn-1", "bush-autumn-2",
      "bush-berry", "mushroom-red", "flowers-red",
      "cactus-1", "cactus-2", "cactus-flower",
      "haybale"
    ],
    "path": [
      "path-dirt-1", "path-dirt-2", "path-dirt-3", "path-dirt-4",
      "path-dirt-5", "path-dirt-6", "path-dirt-7", "path-stone",
      "stone-path"
    ],
    "fence": [
      "fence-left", "fence-mid", "fence-right", "fence-post"
    ],
    "roof": [
      "roof-blue-left", "roof-blue-mid", "roof-blue-right", "roof-blue-peak",
      "roof-blue-bottom-left", "roof-blue-bottom-mid", "roof-blue-bottom-right",
      "roof-red-peak", "roof-brick-peak"
    ],
    "wall": [
      "wall-brick-1", "wall-brick-2", "wall-brick-3", "wall-brick-4",
      "wall-brick-window",
      "wall-wood-1", "wall-wood-2", "wall-wood-3", "wall-wood-4", "wall-wood-5",
      "wall-wood-plank", "wall-wood-window",
      "wall-stone-1", "wall-stone-2", "wall-stone-light",
      "stone-wall"
    ],
    "door": [
      "door-brick", "door-wood"
    ],
    "window": [
      "wall-brick-window", "window-brick", "wall-wood-window", "window-stone"
    ],
    "chimney": [
      "chimney-1", "chimney-2", "chimney-3", "chimney-smoke"
    ],
    "building": [
      "building-dark-1", "building-dark-2", "building-dark-3", "building-dark-4",
      "building-dark-window", "building-dark-door"
    ],
    "castle": [
      "castle-wall-left", "castle-wall-mid", "castle-wall-right", "castle-wall-bottom",
      "castle-battlement", "castle-tower", "castle-flag", "castle-gate", "castle-window",
      "banner"
    ],
    "water": [
      "water-1", "water-2", "water-3", "water-4", "water-5", "water-6",
      "bridge-horizontal", "bridge-vertical", "dock-1"
    ],
    "character": [
      "character-villager-1", "character-villager-2",
      "character-guard", "character-merchant", "character-king",
      "character-knight", "character-wizard", "character-thief"
    ],
    "decoration": [
      "well", "fountain", "sign-shop", "sign-arrow",
      "anvil", "woodpile", "lamp-post", "tombstone",
      "rock-1"
    ],
    "container": [
      "barrel", "barrel-brown", "crate", "chest"
    ],
    "item": [
      "coin-gold", "gold-bag"
    ],
    "vehicle": [
      "cart", "boat"
    ],
    "prop": [
      "awning", "banner", "lamp-post"
    ]
  }
}
