{
  "$schema": "../../schema/sprite-pack.schema.json",
  "id": "tiny-battle",
  "name": "Tiny Battle",
  "source": "kenney",
  "license": "CC0",
  "homepage": "https://kenney.nl/assets/tiny-battle",
  "downloadUrl": "https://kenney.nl/media/pages/assets/tiny-battle/c290ec1e4b-1691487575/kenney_tiny-battle.zip",

  "tileSize": 16,
  "primarySheet": "Tilemap/tilemap_packed.png",

  "metadata": {
    "author": "Kenney",
    "description": "Medieval battle pixel art tileset (16x16) with units, buildings, terrain, and siege equipment",
    "totalAssets": 198,
    "gridSize": { "cols": 18, "rows": 11 }
  },

  "sprites": {
    "tile-000": { "x": 0, "y": 0 },
    "tile-001": { "x": 16, "y": 0 },
    "tile-002": { "x": 32, "y": 0 },
    "tile-003": { "x": 48, "y": 0 },
    "tile-004": { "x": 64, "y": 0 },
    "tile-005": { "x": 80, "y": 0 },
    "tile-006": { "x": 96, "y": 0 },
    "tile-007": { "x": 112, "y": 0 },
    "tile-008": { "x": 128, "y": 0 },
    "tile-009": { "x": 144, "y": 0 },
    "tile-010": { "x": 160, "y": 0 },
    "tile-011": { "x": 176, "y": 0 },
    "tile-012": { "x": 192, "y": 0 },
    "tile-013": { "x": 208, "y": 0 },
    "tile-014": { "x": 224, "y": 0 },
    "tile-015": { "x": 240, "y": 0 },
    "tile-016": { "x": 256, "y": 0 },
    "tile-017": { "x": 272, "y": 0 },
    "tile-018": { "x": 0, "y": 16 },
    "tile-019": { "x": 16, "y": 16 },
    "tile-020": { "x": 32, "y": 16 },
    "tile-021": { "x": 48, "y": 16 },
    "tile-022": { "x": 64, "y": 16 },
    "tile-023": { "x": 80, "y": 16 },
    "tile-024": { "x": 96, "y": 16 },
    "tile-025": { "x": 112, "y": 16 },
    "tile-026": { "x": 128, "y": 16 },
    "tile-027": { "x": 144, "y": 16 },
    "tile-028": { "x": 160, "y": 16 },
    "tile-029": { "x": 176, "y": 16 },
    "tile-030": { "x": 192, "y": 16 },
    "tile-031": { "x": 208, "y": 16 },
    "tile-032": { "x": 224, "y": 16 },
    "tile-033": { "x": 240, "y": 16 },
    "tile-034": { "x": 256, "y": 16 },
    "tile-035": { "x": 272, "y": 16 },
    "tile-036": { "x": 0, "y": 32 },
    "tile-037": { "x": 16, "y": 32 },
    "tile-038": { "x": 32, "y": 32 },
    "tile-039": { "x": 48, "y": 32 },
    "tile-040": { "x": 64, "y": 32 },
    "tile-041": { "x": 80, "y": 32 },
    "tile-042": { "x": 96, "y": 32 },
    "tile-043": { "x": 112, "y": 32 },
    "tile-044": { "x": 128, "y": 32 },
    "tile-045": { "x": 144, "y": 32 },
    "tile-046": { "x": 160, "y": 32 },
    "tile-047": { "x": 176, "y": 32 },
    "tile-048": { "x": 192, "y": 32 },
    "tile-049": { "x": 208, "y": 32 },
    "tile-050": { "x": 224, "y": 32 },
    "tile-051": { "x": 240, "y": 32 },
    "tile-052": { "x": 256, "y": 32 },
    "tile-053": { "x": 272, "y": 32 },
    "tile-054": { "x": 0, "y": 48 },
    "tile-055": { "x": 16, "y": 48 },
    "tile-056": { "x": 32, "y": 48 },
    "tile-057": { "x": 48, "y": 48 },
    "tile-058": { "x": 64, "y": 48 },
    "tile-059": { "x": 80, "y": 48 },
    "tile-060": { "x": 96, "y": 48 },
    "tile-061": { "x": 112, "y": 48 },
    "tile-062": { "x": 128, "y": 48 },
    "tile-063": { "x": 144, "y": 48 },
    "tile-064": { "x": 160, "y": 48 },
    "tile-065": { "x": 176, "y": 48 },
    "tile-066": { "x": 192, "y": 48 },
    "tile-067": { "x": 208, "y": 48 },
    "tile-068": { "x": 224, "y": 48 },
    "tile-069": { "x": 240, "y": 48 },
    "tile-070": { "x": 256, "y": 48 },
    "tile-071": { "x": 272, "y": 48 },
    "tile-072": { "x": 0, "y": 64 },
    "tile-073": { "x": 16, "y": 64 },
    "tile-074": { "x": 32, "y": 64 },
    "tile-075": { "x": 48, "y": 64 },
    "tile-076": { "x": 64, "y": 64 },
    "tile-077": { "x": 80, "y": 64 },
    "tile-078": { "x": 96, "y": 64 },
    "tile-079": { "x": 112, "y": 64 },
    "tile-080": { "x": 128, "y": 64 },
    "tile-081": { "x": 144, "y": 64 },
    "tile-082": { "x": 160, "y": 64 },
    "tile-083": { "x": 176, "y": 64 },
    "tile-084": { "x": 192, "y": 64 },
    "tile-085": { "x": 208, "y": 64 },
    "tile-086": { "x": 224, "y": 64 },
    "tile-087": { "x": 240, "y": 64 },
    "tile-088": { "x": 256, "y": 64 },
    "tile-089": { "x": 272, "y": 64 },
    "tile-090": { "x": 0, "y": 80 },
    "tile-091": { "x": 16, "y": 80 },
    "tile-092": { "x": 32, "y": 80 },
    "tile-093": { "x": 48, "y": 80 },
    "tile-094": { "x": 64, "y": 80 },
    "tile-095": { "x": 80, "y": 80 },
    "tile-096": { "x": 96, "y": 80 },
    "tile-097": { "x": 112, "y": 80 },
    "tile-098": { "x": 128, "y": 80 },
    "tile-099": { "x": 144, "y": 80 },
    "tile-100": { "x": 160, "y": 80 },
    "tile-101": { "x": 176, "y": 80 },
    "tile-102": { "x": 192, "y": 80 },
    "tile-103": { "x": 208, "y": 80 },
    "tile-104": { "x": 224, "y": 80 },
    "tile-105": { "x": 240, "y": 80 },
    "tile-106": { "x": 256, "y": 80 },
    "tile-107": { "x": 272, "y": 80 },
    "tile-108": { "x": 0, "y": 96 },
    "tile-109": { "x": 16, "y": 96 },
    "tile-110": { "x": 32, "y": 96 },
    "tile-111": { "x": 48, "y": 96 },
    "tile-112": { "x": 64, "y": 96 },
    "tile-113": { "x": 80, "y": 96 },
    "tile-114": { "x": 96, "y": 96 },
    "tile-115": { "x": 112, "y": 96 },
    "tile-116": { "x": 128, "y": 96 },
    "tile-117": { "x": 144, "y": 96 },
    "tile-118": { "x": 160, "y": 96 },
    "tile-119": { "x": 176, "y": 96 },
    "tile-120": { "x": 192, "y": 96 },
    "tile-121": { "x": 208, "y": 96 },
    "tile-122": { "x": 224, "y": 96 },
    "tile-123": { "x": 240, "y": 96 },
    "tile-124": { "x": 256, "y": 96 },
    "tile-125": { "x": 272, "y": 96 },
    "tile-126": { "x": 0, "y": 112 },
    "tile-127": { "x": 16, "y": 112 },
    "tile-128": { "x": 32, "y": 112 },
    "tile-129": { "x": 48, "y": 112 },
    "tile-130": { "x": 64, "y": 112 },
    "tile-131": { "x": 80, "y": 112 },
    "tile-132": { "x": 96, "y": 112 },
    "tile-133": { "x": 112, "y": 112 },
    "tile-134": { "x": 128, "y": 112 },
    "tile-135": { "x": 144, "y": 112 },
    "tile-136": { "x": 160, "y": 112 },
    "tile-137": { "x": 176, "y": 112 },
    "tile-138": { "x": 192, "y": 112 },
    "tile-139": { "x": 208, "y": 112 },
    "tile-140": { "x": 224, "y": 112 },
    "tile-141": { "x": 240, "y": 112 },
    "tile-142": { "x": 256, "y": 112 },
    "tile-143": { "x": 272, "y": 112 },
    "tile-144": { "x": 0, "y": 128 },
    "tile-145": { "x": 16, "y": 128 },
    "tile-146": { "x": 32, "y": 128 },
    "tile-147": { "x": 48, "y": 128 },
    "tile-148": { "x": 64, "y": 128 },
    "tile-149": { "x": 80, "y": 128 },
    "tile-150": { "x": 96, "y": 128 },
    "tile-151": { "x": 112, "y": 128 },
    "tile-152": { "x": 128, "y": 128 },
    "tile-153": { "x": 144, "y": 128 },
    "tile-154": { "x": 160, "y": 128 },
    "tile-155": { "x": 176, "y": 128 },
    "tile-156": { "x": 192, "y": 128 },
    "tile-157": { "x": 208, "y": 128 },
    "tile-158": { "x": 224, "y": 128 },
    "tile-159": { "x": 240, "y": 128 },
    "tile-160": { "x": 256, "y": 128 },
    "tile-161": { "x": 272, "y": 128 },
    "tile-162": { "x": 0, "y": 144 },
    "tile-163": { "x": 16, "y": 144 },
    "tile-164": { "x": 32, "y": 144 },
    "tile-165": { "x": 48, "y": 144 },
    "tile-166": { "x": 64, "y": 144 },
    "tile-167": { "x": 80, "y": 144 },
    "tile-168": { "x": 96, "y": 144 },
    "tile-169": { "x": 112, "y": 144 },
    "tile-170": { "x": 128, "y": 144 },
    "tile-171": { "x": 144, "y": 144 },
    "tile-172": { "x": 160, "y": 144 },
    "tile-173": { "x": 176, "y": 144 },
    "tile-174": { "x": 192, "y": 144 },
    "tile-175": { "x": 208, "y": 144 },
    "tile-176": { "x": 224, "y": 144 },
    "tile-177": { "x": 240, "y": 144 },
    "tile-178": { "x": 256, "y": 144 },
    "tile-179": { "x": 272, "y": 144 },
    "tile-180": { "x": 0, "y": 160 },
    "tile-181": { "x": 16, "y": 160 },
    "tile-182": { "x": 32, "y": 160 },
    "tile-183": { "x": 48, "y": 160 },
    "tile-184": { "x": 64, "y": 160 },
    "tile-185": { "x": 80, "y": 160 },
    "tile-186": { "x": 96, "y": 160 },
    "tile-187": { "x": 112, "y": 160 },
    "tile-188": { "x": 128, "y": 160 },
    "tile-189": { "x": 144, "y": 160 },
    "tile-190": { "x": 160, "y": 160 },
    "tile-191": { "x": 176, "y": 160 },
    "tile-192": { "x": 192, "y": 160 },
    "tile-193": { "x": 208, "y": 160 },
    "tile-194": { "x": 224, "y": 160 },
    "tile-195": { "x": 240, "y": 160 },
    "tile-196": { "x": 256, "y": 160 },
    "tile-197": { "x": 272, "y": 160 }
  },

  "tags": {
    "terrain": ["tile-000", "tile-001", "tile-002", "tile-003", "tile-004", "tile-005", "tile-006", "tile-007", "tile-008", "tile-009", "tile-010", "tile-011"],
    "unit": ["tile-036", "tile-037", "tile-038", "tile-039", "tile-054", "tile-055", "tile-056", "tile-057", "tile-072", "tile-073", "tile-074", "tile-075"],
    "building": ["tile-090", "tile-091", "tile-092", "tile-093", "tile-108", "tile-109", "tile-110", "tile-111"],
    "siege": ["tile-126", "tile-127", "tile-128", "tile-129", "tile-144", "tile-145", "tile-146", "tile-147"]
  }
}
