{
  "$schema": "../../schema/sprite-pack.schema.json",
  "id": "horses-arne16",
  "name": "Horses - Arne16",
  "source": "opengameart",
  "license": "CC0",
  "homepage": "https://opengameart.org/content/horses-arne16",
  "downloadUrl": "https://opengameart.org/sites/default/files/horse_4.png",

  "tileSize": 16,
  "primarySheet": "horse_4.png",

  "metadata": {
    "author": "zwonky (original: DualR)",
    "description": "Horse sprites with 2-frame walk cycle in 4 colors. Uses Arne16 palette.",
    "notes": "Sheet is 32x64 pixels. 4 horse colors with 2 walk frames each."
  },

  "sprites": {
    "horse-brown-walk-1": { "x": 0, "y": 0 },
    "horse-brown-walk-2": { "x": 16, "y": 0 },
    "horse-tan-walk-1": { "x": 0, "y": 16 },
    "horse-tan-walk-2": { "x": 16, "y": 16 },
    "horse-white-walk-1": { "x": 0, "y": 32 },
    "horse-white-walk-2": { "x": 16, "y": 32 },
    "horse-black-walk-1": { "x": 0, "y": 48 },
    "horse-black-walk-2": { "x": 16, "y": 48 }
  },

  "tags": {
    "animal": ["horse-brown-walk-1", "horse-brown-walk-2", "horse-tan-walk-1", "horse-tan-walk-2", "horse-white-walk-1", "horse-white-walk-2", "horse-black-walk-1", "horse-black-walk-2"],
    "horse": ["horse-brown-walk-1", "horse-brown-walk-2", "horse-tan-walk-1", "horse-tan-walk-2", "horse-white-walk-1", "horse-white-walk-2", "horse-black-walk-1", "horse-black-walk-2"]
  }
}
