{
  "$schema": "../../schema/sprite-pack.schema.json",
  "id": "cowboy-character",
  "name": "Cowboy Character",
  "source": "opengameart",
  "license": "CC0",
  "homepage": "https://opengameart.org/content/cowboy",
  "downloadUrl": "https://opengameart.org/sites/default/files/Cowboy%204%20HiRes_0.zip",

  "metadata": {
    "author": "pzUH",
    "description": "Pixel art cowboy with 8 animation cycles for sidescroller games. Includes idle, walk, jump, and shoot animations with/without gun variants.",
    "totalAssets": 8,
    "notes": "Sprite sheet layout needs verification after download. Creator has larger Western Package with tileset, 7 characters, and parallax backgrounds."
  },

  "sprites": {
    "idle-no-gun": {
      "frames": [
        { "x": 0, "y": 0, "w": 32, "h": 32 }
      ],
      "fps": 1,
      "loop": true
    },
    "idle-with-gun": {
      "frames": [
        { "x": 32, "y": 0, "w": 32, "h": 32 }
      ],
      "fps": 1,
      "loop": true
    },
    "walk-no-gun": {
      "frames": [
        { "x": 0, "y": 32, "w": 32, "h": 32 },
        { "x": 32, "y": 32, "w": 32, "h": 32 },
        { "x": 64, "y": 32, "w": 32, "h": 32 },
        { "x": 96, "y": 32, "w": 32, "h": 32 }
      ],
      "fps": 8,
      "loop": true
    },
    "walk-with-gun": {
      "frames": [
        { "x": 0, "y": 64, "w": 32, "h": 32 },
        { "x": 32, "y": 64, "w": 32, "h": 32 },
        { "x": 64, "y": 64, "w": 32, "h": 32 },
        { "x": 96, "y": 64, "w": 32, "h": 32 }
      ],
      "fps": 8,
      "loop": true
    },
    "jump-no-gun": {
      "frames": [
        { "x": 0, "y": 96, "w": 32, "h": 32 }
      ],
      "fps": 1,
      "loop": false
    },
    "jump-with-gun": {
      "frames": [
        { "x": 32, "y": 96, "w": 32, "h": 32 }
      ],
      "fps": 1,
      "loop": false
    },
    "shoot-standing": {
      "frames": [
        { "x": 0, "y": 128, "w": 32, "h": 32 },
        { "x": 32, "y": 128, "w": 32, "h": 32 }
      ],
      "fps": 10,
      "loop": false
    },
    "shoot-jumping": {
      "frames": [
        { "x": 64, "y": 128, "w": 32, "h": 32 },
        { "x": 96, "y": 128, "w": 32, "h": 32 }
      ],
      "fps": 10,
      "loop": false
    }
  },

  "tags": {
    "player": [
      "idle-no-gun", "idle-with-gun",
      "walk-no-gun", "walk-with-gun",
      "jump-no-gun", "jump-with-gun",
      "shoot-standing", "shoot-jumping"
    ],
    "idle": ["idle-no-gun", "idle-with-gun"],
    "walk": ["walk-no-gun", "walk-with-gun"],
    "jump": ["jump-no-gun", "jump-with-gun"],
    "shoot": ["shoot-standing", "shoot-jumping"],
    "armed": ["idle-with-gun", "walk-with-gun", "jump-with-gun", "shoot-standing", "shoot-jumping"],
    "unarmed": ["idle-no-gun", "walk-no-gun", "jump-no-gun"]
  }
}
