{
  "$schema": "../../schema/sprite-pack.schema.json",
  "id": "animal-pack-redux",
  "name": "Animal Pack Redux",
  "source": "kenney",
  "license": "CC0",
  "homepage": "https://kenney.nl/assets/animal-pack-redux",
  "downloadUrl": "https://kenney.nl/media/pages/assets/animal-pack-redux/c217650a92-1677666936/kenney_animal-pack-redux.zip",

  "primarySheet": "Spritesheet/square.png",

  "metadata": {
    "author": "Kenney",
    "description": "Cute cartoon animal sprites (30 animals). Pack includes 8 style variants: round/square, with/without details, with/without outlines. Primary sheet uses square style with details.",
    "totalAssets": 240,
    "alternateSheets": [
      "Spritesheet/round.png",
      "Spritesheet/squareOutline.png",
      "Spritesheet/roundOutline.png",
      "Spritesheet/square_nodetails.png",
      "Spritesheet/round_nodetails.png",
      "Spritesheet/square_nodetailsOutline.png",
      "Spritesheet/round_nodetailsOutline.png"
    ]
  },

  "sprites": {
    "bear": { "x": 186, "y": 162, "w": 162, "h": 128 },
    "buffalo": { "x": 0, "y": 290, "w": 184, "h": 154 },
    "chick": { "x": 626, "y": 577, "w": 128, "h": 128 },
    "chicken": { "x": 625, "y": 271, "w": 128, "h": 145 },
    "cow": { "x": 0, "y": 162, "w": 186, "h": 128 },
    "crocodile": { "x": 687, "y": 0, "w": 128, "h": 128 },
    "dog": { "x": 751, "y": 416, "w": 128, "h": 161 },
    "duck": { "x": 559, "y": 0, "w": 128, "h": 128 },
    "elephant": { "x": 0, "y": 615, "w": 184, "h": 138 },
    "frog": { "x": 348, "y": 161, "w": 138, "h": 128 },
    "giraffe": { "x": 268, "y": 0, "w": 162, "h": 161 },
    "goat": { "x": 0, "y": 444, "w": 184, "h": 171 },
    "gorilla": { "x": 354, "y": 289, "w": 128, "h": 128 },
    "hippo": { "x": 184, "y": 418, "w": 166, "h": 128 },
    "horse": { "x": 615, "y": 128, "w": 128, "h": 143 },
    "monkey": { "x": 178, "y": 753, "w": 174, "h": 128 },
    "moose": { "x": 0, "y": 0, "w": 268, "h": 162 },
    "narwhal": { "x": 352, "y": 703, "w": 146, "h": 145 },
    "owl": { "x": 495, "y": 546, "w": 128, "h": 128 },
    "panda": { "x": 0, "y": 753, "w": 178, "h": 128 },
    "parrot": { "x": 623, "y": 449, "w": 128, "h": 128 },
    "penguin": { "x": 350, "y": 418, "w": 147, "h": 128 },
    "pig": { "x": 184, "y": 290, "w": 170, "h": 128 },
    "rabbit": { "x": 497, "y": 273, "w": 128, "h": 176 },
    "rhino": { "x": 184, "y": 546, "w": 163, "h": 128 },
    "sloth": { "x": 498, "y": 674, "w": 128, "h": 128 },
    "snake": { "x": 430, "y": 0, "w": 129, "h": 139 },
    "walrus": { "x": 486, "y": 139, "w": 129, "h": 134 },
    "whale": { "x": 347, "y": 546, "w": 148, "h": 157 },
    "zebra": { "x": 626, "y": 705, "w": 128, "h": 145 }
  },

  "tags": {
    "farm": ["cow", "chicken", "chick", "pig", "goat", "horse", "duck"],
    "wild": ["bear", "buffalo", "crocodile", "elephant", "giraffe", "gorilla", "hippo", "moose", "rhino", "zebra", "snake"],
    "pet": ["dog", "rabbit", "frog", "parrot"],
    "bird": ["chicken", "chick", "duck", "owl", "parrot", "penguin"],
    "aquatic": ["narwhal", "walrus", "whale", "frog", "crocodile"],
    "primate": ["monkey", "gorilla", "sloth"],
    "arctic": ["penguin", "narwhal", "walrus", "whale", "panda", "moose", "bear"]
  }
}
